skill	name	ST	発動,時間	Delay	説明
水泳30	ケロっと ショット	15	140	1240	対象を背中の水鉄砲でずぶ濡れにして移動速度を低下させる,発動に必要なBuff : ウォーター タンク
生命 50	ファイアー バード,(Fire Bird)	23	200	1500	不死鳥の炎を身に纏い、両腕を広げて突進して前方に火属性のダメージを与える技,発動に必要なBuff : 不死鳥の力
生命力 1	プロテクション バリア	MP15	120	1300	攻撃や魔法から身を守る保護障壁を展開する,発動に必要なBuff : オート プロテクション
生命力 1	ドラゴン フォース	50	150	3150	漆黒の竜に変身して攻撃力と防御力と牙スキルの威力が上昇して、回避が低下する,発動に必要なBuff : 竜化の秘法
生命力 1	メダロット フルチャージ	35	200	4200	溜めたエネルギーを開放してHPを大回復し、デバフを解除する,※回復量は生命力スキルに依存します,発動に必要なBuff : ディアステージ フォーム
生命力 30	カオス ブレイカー,(Chaos Breaker)	20	200	900	カオス生物に対して絶大な威力を持つ生命エネルギーを放つ技
生命力 70,神秘魔法 20	火竜の咆哮,(Fire Dragon Iron Roar)	33	150	1550	口から灼熱の炎のブレスを放つ
生命力40,持久力40	いやしのくうかん	21	184	1840	みんなでぴょんぴょんたのしいな♪
生命力70	レゾナンス フォース,(Resonance Force)	9	100	1100	特殊テクニックが使用可能になる,使用可能技 → レゾナンスフォース使用技
生命力80,持久力80	エンデュランス,(Endurance)	38	120	2320	即死級のダメージを受けても一度だけ HPが1残り耐えることができる,発動に必要なBuff : ウォーリアー マスタリー or ブレイブナイト マスタリー, or パーフェクト・ウォリアー
精神 70,知能 50	マインド ショット,(Mind Shot)	40	180	1380	マナを一点に集約させて弾丸のように放つ技
精神力 1	サイコキャノン,(Psycho Cannon)	MP60	180	1080	ノアガンアームにチャージされたノアストーンのエネルギーを放出する,発動に必要なBuff : サイコチャージ
精神力 1	ラブリー チョコレート	MP30	130	650	自分以外の対象に無償の愛でMPを分け与える,※スキルが足りなくても発動可能,発動に必要なBuff : スウィート ハート
精神力 1	アンチ マジック シェル	30	150	2200	一時的に魔法のダメージを軽減するバリアを展開する,発動に必要なBuff : シェル ガード
精神力 1	ピーチ キャノン	20	130	450	杖の力を借りて桃のエネルギー弾を放ち、与えたダメージの20％分MPが回復する,※スキルが足りなくても発動可能、精神力スキルで威力が上がる,発動に必要なBuff : 桃の加護
精神力 1	マナ バースト,(Mana Burst)	20	0	300	マナを消費して瞬間的に加速させることができる,※WarAgeでは効果が無い,発動に必要なBuff : ライド バイク
精神力 150,集中力 150	ヒーロー タイム	100	110	32400	全ステータスが跳ね上がり、どんな敵も一撃で倒し,あらゆる攻撃が当たらず、大爆発に巻き込まれても平気になる
精神力 30	チェイン オブ バインド	20	200	1200	魔力で鎖を操作し、敵を捕縛して無力化する,※ダメージで解除される,発動に必要なBuff : ペンデュラム
精神力 30	大樹の奇跡,(Miracle of Big Tree)	15	140	1500	大樹の力により範囲攻撃の範囲が少し増加する,※WarAgeでは効果が無い,発動に必要なBuff : 大樹の加護
精神力 60,神秘魔法40	桜花乱舞	28	150	2150	桜の魔法陣を展開して周囲にいる味方のダメージを軽減する
精神力 70,強化魔法70	エンハンスド ブレイカー	MP33	160	1140	魔力の50％を攻撃力に上乗せして強力な一撃を放つ,Hit時に魔法の詠唱を中断させる
精神力 70,知能 50	ベルカ式魔法陣(ヴィータ),(Belka Circle Vita)	33	200	2200	足元に古代ベルカ式の魔法陣を展開させて魔法陣内にいるキャラクターの攻撃力を増加させる,※WarAgeでは効果が無い,使用アイテム : PNQ×３
精神力 70,知能 50	ベルカ式魔法陣(はやて),(Belka Circle Hayate)	33	200	2200	足元に古代ベルカ式の魔法陣を展開させて魔法陣内にいるキャラクターの攻撃範囲を増加させる,※WarAgeでは効果が無い,使用アイテム : PNQ×３
精神力 70,知能 50	ミッドチルダ式魔法陣(なのは),(Mid Circle Nanoha)	33	200	2200	足元にミッドチルダ式の魔法陣を展開させて魔法陣内にいるキャラクターの魔力と魔法の射程を上昇させる,※WarAgeでは効果が無い,使用アイテム : PNQ×３
精神力 70,知能 50	ミッドチルダ式魔法陣(フェイト),(Mid Circle Fate)	33	200	2200	足元にミッドチルダ式の魔法陣を展開させて魔法陣内にいるキャラクターの回避と移動速度を上昇させる,※WarAgeでは効果が無い,使用アイテム : PNQ×３
精神力 80,精神力 60,戦闘技術 60	ギガンテック ウェポン,(Gigantic Weapon)	39,28	180	1500	魔法の力で武器を巨大化して一刀両断にする技,※発動するためには両手持ちの近接武器が必要です
精神力 80,魔法熟練60	エクステンション サークル	38	200	2200	周囲に球状の魔法陣を展開させて,魔法陣内にいるキャラクターの射程、攻撃範囲を増加させる,※WarAgeでは効果がない,使用アイテム : ピュア ノア キューブ 3
精神力1	フル スロットル	MP40	0	1200	アクセル全開でぶっ飛ばす！！,マナを消費して一時的に移動速度を大幅に上昇させることができる,※WarAgeでは効果が無い,発動に必要なBuff : ドライビング or レッドゾーン
精神力1	エンジェル フォール	5	0	1500	不思議な魔石の力でゆっくりと浮遊しながら落下することができる,※効果中に地面に届かない場合はダメージを受ける,発動に必要なBuff : 魔石の力
精神力1	妖力解放,(Magical Power Release)	5	150	54000	九尾の妖力を解放することで一時的に魔力を大幅に上昇させるが、体にかかる負荷も大きい,※再使用には魔力回復のために時間がかかる,発動に必要なBuff : 九尾の力
精神力30	Ｍ インパクト,(M Impact)	15	80	900	魔力を込めた光の珠を飛ばす,※精神力が高いほど威力があがる技,両手武器専用
精神力30	マインド インパクト,(Mind Impact)	15	80	680	魔力を 込めた光の弾を飛ばす,※精神力が高いほど威力が上がる技,発動に必要なBuff : ナールドスタッフ
精神力40	蛇帯乱舞	21	150	1500	蛇帯が周囲を乱れ飛び敵を切り刻む,発動に必要なBuff : 蛇帯
精神力50,知能50	アジリティ サークル,(Agility Circle)	23	200	2200	足元に魔法陣を展開させて,魔法陣内にいるキャラクターの回避と攻撃速度を上昇させる,使用アイテム : PNQ×３
精神力50,知能50	マジック サークル,(Magic Circle)	23	200	2200	足元に魔法陣を展開させて,魔法陣内にいるキャラクターの魔力とMP回復速度を上昇させる,使用アイテム : PNQ×３
精神力60,戦闘技術50	幻桜	28	200	1800	桜吹雪と共に姿を消し、不意の一撃で攻撃がクリティカルになる
精神力80,魔法熟練80	グレート マジック サークル	38	150	2400	巨大な魔法陣を展開して術者の魔力と詠唱速度を上昇させる,使用アイテム : PNQ×３
戦闘技術 1	立体機動,(3D Maneuver)	5	20	420	対象にアンカーを撃ち込み、ワイヤーを巻き上げることで高速移動ができる。,※対象は採取可能なオブジェクト、アクションポイント、巨人,発動に必要なBuff : 立体機動装置
戦闘技術 60,キック 90	ネオ トルネード,(Neo Tornado)	45	295	1250	周囲の敵を引き寄せ、蹴り飛ばす
戦闘技術1	巻藁召喚	5	60	360	試し斬り用の巻藁を召喚する,※右クリックで破壊可能/破壊不能を切り替えることができる,※フラグは共通のため、設置した全ての巻藁に適応される,使用アイテム : わら 1
戦闘技術1,パフォーマンス1	バトル オーラ,(Battle Aura)	20	180	1180	全身から闘気を解放して相手を威嚇する,気持ちが高まって戦闘力がほんの少し上昇する
戦闘技術40	ウォークライ,(Warcry)	19	180	1180	雄叫びを上げて周囲の敵を怯ませ、足止めする,発動に必要なBuff : ウォーリアー マスタリー or パーフェクト・ウォリアー
戦闘技術50,盾 50	アンカー ハウル	23	220	1600	裂帛の雄たけびを上げることで敵に自分が脅威であることを知らしめ、瞬間的に自分への敵対心を煽る,同時に自身も戦いに備えることで、短時間ではあるが防御力上昇する
戦闘技術50,盗み 30	アーリー スラスト	23	40	900	相手の弱点をマーキングし、マーキングを狙うことで1度だけダメージを増加させる,※ダメージを与えるとマーキングが解除される,※発動には右手に近接武器を装備している必要がある
戦闘技術60	シバルリー スピリッツ	28	280	1780	背後に守るべき者が多いほど体力（HP）を回復する,発動に必要なBuff : ウォーリアー マスタリー or ブレイブナイト マスタリー
戦闘技術60	テンションアップ	28	150	1950	テンションを上げることで一定時間、範囲攻撃の範囲が広がる,発動に必要なBuff : ウォーリアー マスタリー or ブレイブナイト マスタリー
戦闘技術60	リコール トイソルジャー	28	150	1500	複数の兵士を同時に呼び出す,※発動には一人当たり200G(J)×4人分の800G(J)が必要です。,発動に必要なBuff : 傭兵 マスタリー,使用Gold(Jade) : 800
戦闘技術70,攻撃回避90	バック ステップ,(Back Step)	28	20	500	後ろへ飛ぶことにより攻撃を避ける
戦闘技術80,筋力 80	マスター ストレングス	38	120	1500	次の物理攻撃で与えるダメージが2倍以上になる,※他の行動をとると技の効果はキャンセルされる
戦闘技術80,神秘魔法80	チェンジ エナジー,(Change Energy)	0	200	1200	HPをスタミナへと変換することができる
戦闘技術80,生命力 80	バリアント ブロウ	38	140	1800	ピンチになるほど威力が上昇する逆転の一撃,HPが50％以下で発動できる,※確率でクリティカルの効果が発生する
戦闘技術90,攻撃回避90,筋力90,包帯90,精神力90	プロストレイト,(Prostrate)	33	240	1200	威厳に満ちたオーラで周囲の敵を平伏させる,1の固定ダメージ
戦闘技術90,盾60	ウェポン ガード,(Weapon Guard)	28	190	900	装備している両手武器で敵の直接攻撃を防御する,両手武器専用
素手 1	メダロット サンダー	25	100	1300	対象にダメージを与えて麻痺させ、一時的に行動不可能状態にする,※発動には近接武器を装備している必要があります,発動に必要なBuff : ペッパーキャット フォーム
素手 1	メダロット フリーズ	25	120	1300	対象にダメージを与え凍結させ、凍結中は防御と回避が0になる,※ダメージを受けると解除される,※発動には接近武器を装備している必要があります,発動に必要なBuff : ディアステージ フォーム
素手 1	アトラクション フォース	15	200	1000	対象に磁性を与えて左手の磁力で引き寄せる,発動に必要なBuff : 磁力操作
素手 30	バックハンド チョップ,(Backhand Chop)	15	120	980	対象の胸元めがけて 水平にチョップする,発動に必要なBuff : 荒くれ者 マスタリー
素手 40	ライジング ドラゴン,(Rising Dragon)	30	180	1300	右腕に封印された龍神の力を解放して大ダメージを与える,発動に必要なBuff : 封印されし龍神
素手 50,神秘魔法 20	火竜の鉄拳,(Fire Dragon Iron Fist)	23	90	1200	炎を纏った拳で敵を殴りつける,※ドラゴンタイプに特効効果あり
素手 60	張り手	28	160	1000	両腕から強烈な張り手を繰り出して敵を押し出す,発動に必要なBuff : 力士
素手 60	毒霧,(Green Mist)	28	150	1050	口に含んだ特殊な液体を対象の顔めがけて吹きかけて視界を奪う,発動に必要なBuff : 荒くれ者 マスタリー,使用アイテム : 練りワサビ
素手 70	フライング ボディプレス	33	160	1200	空高く飛び上がり対象に自身の体を浴びせる技,発動に必要なBuff : 荒くれ者 マスタリー
素手 8,生命力 8	ラブナックル！,(Love Knuckle)	12	180	1050	ただ全力で放つ愛の拳！この気持ち！まさしく愛です！
素手 80,キック 80	ローリング ラリアット,(Rolling Lariat)	38	120	1200	軸足を中心に独楽のように回転しながら相手の首元にラリアットを決める
素手 80,キック 80	功夫乱舞,(Kung Fu Ranbu)	30	280	1500	拳と蹴りによる華麗な舞で周囲の敵を蹴散らす連撃
素手 80,筋力 80	グランド インパクト,(Ground Impact)	38	200	1800	力を込めた一撃が地面を伝わって広がり周囲にいる敵にダメージを与える
素手 80,攻撃回避 80	コンビネーション ラッシュ,(Combineation Rush*2)	39	140	1300	隙の少ない連打で確実に対象へダメージを与える
素手 80,精神力 50	龍気発勁,(Releage Internal Power)	38	200	1000	大地に流れる気を集めて放出する技
素手 80,戦闘技術70	閃光裂破拳	38	100	1000	光を纏った拳の一撃による衝撃波が、ガードを貫通して対象を吹き飛ばす
素手 90,神秘魔法 20	紅蓮火竜拳	45	150	3000	通常攻撃HIT時に「 火竜の鉄拳 」が追加で発動する,※ドラゴンタイプに特効効果あり
素手1	サイクロン バキューム,(Cyclone Vacuum)	5	200	1550	サイクロン バスターで前方にある全ての物を吸い込む,発動に必要なBuff : お掃除モード
素手60	ジャンピング ヒップ アタック	28	120	1000	相手に背を向けながら臀部を後ろに突き出して対象の胸付近に飛び込む技,発動に必要なBuff : 荒くれ者 マスタリー
素手70,攻撃回避70	クロス カウンター,(Cross Counter)	33	90	1140	相手の攻撃をギリギリで交してカウンター気味にパンチを放つ
素手80	Ｂ ラッシュ,(B Rush)	38	275	1500	素手とキックの連続攻撃を繰り出すことができる,※素手のみでも発動できるがキックスキルが高いとダメージが増加する
素手80	オーラ ナックル,(Aura Knuckle)	38	140	1200	気を拳に集中させて威力を高めた一撃を放つ,※ダメージ反射効果を無効化してダメージを与える,※シールド ガードを貫通することはできない,発動に必要なBuff : 酔拳士 マスタリー or 荒くれ者 マスタリー
素手80	ブリッツ ラッシュ	38	335	1500	素手とキックの連続攻撃を繰り出すことができる,※素手のみでも発動できるが キックスキルが高いとダメージが増加する,発動に必要なBuff 特殊効果:ナックル
槍 40,精神力 30	マナ スラスト,(Mana Thrust)	MP30	135	1100	槍をマナの力で強化して 対象の防御を無効化する一撃を放つ
槍 70,強化魔法 70	ゲイル スラスト,(Gale Thrust)	33	125	1200	疾風の如き速さで 無数の突きを繰りだす
槍 70,水泳 40	アクア ダイブ	33	180	1250	水の力を纏った状態で大ジャンプを行い、,頭上めがけて槍を突き刺し水属性の追加ダメージを与える
槍 70,投げ 50	ジャベリン スロウ,(Javelin Throw)	33	130	1500,(191008以降)	装備した槍を前方の敵めがけて 全力で投げる,※対象を基準に 後方の敵も貫く 投げた武器の耐久は大幅に減少する投げた武器は失ってしまう
槍 80	ブレイン ブレイカー	38	150	1500	高速で無数の突きを繰り出し、対象のMPを削り取る,発動に必要なBuff : デュエリスト マスタリー
槍 80,強化魔法80	魔槍烈破	MP38	150	1200	闘気に魔力を乗せて放つ槍の秘技,※魔力が高いほどダメージが増加する
槍 80,戦闘技術 80,攻撃回避 80	パリィ カウンター,(Parry Counter)	38	95	1300	敵の攻撃を槍で受け流して反撃する
槍 90,攻撃回避 90	インフィニット スラスト	45	200	1350	目にも留まらぬ高速の連続突きで敵を翻弄する,※片手槍でのみ発動出来る
槍 90,水泳 90	ウォーター ストリーム,(Water Stream)	45	170	1100	水を操り 敵を押し流す,発動に必要なBuff : 海戦士 マスタリー
槍60	Ｖ ウェイブ,(V Wave)	28	180	1200	突き立てた槍が、幻影の高波を引き起こし,対象を巻き込む
槍60	ヴィジット ウェイブ	28	180	900	突き立てた槍が、幻影の高波を引き起こし,対象を巻き込む,発動に必要Buff 特殊効果:バトルフォーク
槍80	バーン ピール	38	280	1000	雷を呼び寄せ 周囲の敵を焼き払う,発動に必要Buff 特殊効果:トライデント
槍90,キック60	超ドラゴンフォール	45	205	1440	遥か上空へ大ジャンプを行い 落下中に空中制動して頭上から槍を突き立てる
槍90,戦闘技術60	ウインドミル スピアー,(Windmill Spear)	45	135	1650	槍を前方で高速回転させることで 敵の攻撃を跳ね返しダメージを与える,両手槍専用
鍛治 60,暗黒命令 30	デストロイ ウェポン,(Destroy Weapon)	28	150	1150	ターゲットに少量のダメージを与え、武器の耐久度を大幅に減らす
鍛冶90,裁縫90,木工90,装飾90,複製90,料理90,醸造90,薬調合90	ゴッド ハンド,(God Hand)	25	150	30300	極めしものが到達できる領域,使用アイテム : ゴッドアイ
着こなし30	氷鏡の壁	19	140	1140	物理攻撃を防ぐ氷の壁を生成して、壁に触れた対象を凍らす,発動に必要なBuff : 氷炎の使い手
着こなし80	ガードレイジ	38	150	1650	ダメージを軽減し、効果中にダメージを受けると確率で一時的に攻撃力が上昇する,発動に必要なBuff : デュエリスト マスタリー
着こなし80,戦闘技術70	アトラクト,(Attract)	28	140	1200	敵の注意を引き付けて味方を守る,発動に必要なBuff : ブレイブナイト マスタリー
着こなし80,物まね90	パーフェクト ミミック,(Perfect Mimic)	-	-	-	※151110パッチで仕様が変更されたため、物まねスキルの項目に移動,※下記短評も移動
調教 1	にゃんこ大集合	5	180	2150	マタタビの香りに釣られて猫たちが集まってくる,使用アイテム : マタタビ パウダー 1
調教 30	グルーミング ケア	15	200	1700	ペットを毛繕いすることでペットのパフォーマンスを向上させる,※攻撃、命中、回避、防御、魔力を8%上昇させる,発動に必要なBuff : グルーミング
調教 30,神秘魔法 30	制約の鎖	15	120	1320	魔法の鎖でペット1体の行動を制限して攻撃力と回避を一定時間半減させる
調教 40,集中力 40	スパート ウィップ,(Spurt Whip)	19	120	1200	ペットに追い込みをかけて一時的に移動速度を上昇させる
調教 50	トリミング ケア,(Trimming Care)	23	220	1120	ペットの身体的ケアからメンタル面のケアまでしっかりサポート！,※ペットにかかっているDEBUFFを消し去り、MPを回復する,発動に必要なBuff : ブリーダー マスタリー
調教1	リミット スペル	5	120	1620	ペットの呪文詠唱を制限する代わりにペットの成長率が少しだけ上昇する発動に必要なBuff : 犬笛
調教40	ひよこ鑑定	15	150	750	ひよこの性別を鑑定することができる,発動に必要なBuff : ブリーダー マスタリー
調教60	ブリーディング ウィップ,(Breeding Whip)	28	110	2510	ペットに特殊攻撃をさせる,※ペットが特殊攻撃を使える状態の時のみ発動する,発動に必要なBuff : ブリーダー マスタリー
調教90	エリア チェリッシング,(Area Cherishing)	45	220	1020	愛情を込めて周囲にいるペットを介抱し、HPを回復させる,発動に必要なBuff : ブリーダー マスタリー
釣り90	キャッチ ターゲット,(Catch Target)	35	595	800	極めし者の技 地上の獲物も軽々と釣り上げる,発動に必要なBuff : 海戦士 マスタリー,釣竿装備時のみ使用可能
刀剣 1	メダロット ソード	25	120	1300	威力の高い単体斬撃,※発動には近接武器を装備している必要があります,発動に必要なBuff : ロクショウ フォーム
刀剣 10,戦闘技術 10	レイジブロー,(Rage Blow)	9	150	1200	踏み込みと共に両手剣で斬り裂く攻撃
刀剣 30	斬り斬り舞,(Kirikirimai)	15	200	2200	回転で生じた風の刃が周囲の敵を切り刻む,発動に必要なBuff : 円月輪
刀剣 30,盗み 30	バックスタブ,(Back Stab)	15	120	1200	相手の背後から片手剣を急所に突き刺し、ダメージを与える,背後以外から発動できない
刀剣 40	刈り払い,(Karibarai)	19	120	800	防具の隙間を素早く横に薙ぎ払うように斬りつける,発動に必要なBuff : フォレスター マスタリー
刀剣 40,暗黒命令 40	ヘイトレッド,(Hatred)	19	200	1200	勢いよく踏み込むと共に剣を上から振り下ろす攻撃
刀剣 50,知能 30	レッグ スラッシュ,(Leg Slash)	23	155	1100	両足を斬り付け動きを鈍らす,※対象の移動速度上昇技を無効化させる
刀剣 60,牙 40	ヴァイパー ストラッシュ	28	180	1200	腕の腱を傷つける攻撃で出血させ、継続的なダメージと命中率ダウン効果を与える
刀剣 70	弧月破斬	33	130	1250	神速の居合から剣圧による斬撃を飛ばす,発動に必要なBuff : サムライ マスタリー or 神霊の加護
刀剣 70,筋力 80	大切断	33	140	1350	大木を切り倒すような強力な一撃で敵を斬りつける
刀剣 70,自然調和 50	一閃,(Thrust Sword)	33	120,(80)	1200	一瞬で間合いを詰めて 敵を貫く
刀剣 70,生命力 90	背水の一閃	33	160	2000	HPが少ないほど威力が上昇する捨て身の一撃
刀剣 80	アサシネイト	38	120	2000	敵に気づかれずに背後から攻撃することで大ダメージを与える暗殺術,背後以外から攻撃出来ない,発動に必要なBuff : アサシン マスタリー
刀剣 80	乱れ桜,(Cherry Flowers)	38	300	1200	桜吹雪の幻影と共に 一瞬で敵の周囲を切りつける美技,発動に必要なBuff:サムライ マスタリー
刀剣 90	回転斬り,(Spinning Slash)	45	160	1300	リヴァイが得意とする高速回転切り。,※空中で発動可能,,※限定課金アイテムなので複合に記載。
刀剣 90	居合斬り,(Iai)	45	180	1500	異国の剣士が編み出した秘奥義の一つ。対象の装甲を貫く目にも止まらぬ音速の一撃。,発動に必要なBuff : サムライ マスタリー
刀剣 90	桜花一閃	45	150	1500	桜吹雪と共に一閃を放ち、舞い散る花びらが対象の視界を奪う,発動に必要なBuff : サムライ マスタリー or 桜花爛漫
刀剣 90	天輪・繚乱の剣,(***)	45	220	1500	すれ違い様に、無数の刃が対象を連続で切り裂く,※発動には左右に刀剣武器を装備する必要がある,発動に必要なBuff : ウォーリア― マスタリー or サムライ マスタリー, or 騎士(ザ・ナイト)
刀剣 90,攻撃回避70	燕返し	45	190	1500	水平斬りから素早く反転させて斬りつける技,二太刀目は必中の一撃となる,発動に必要なBuff : サムライ マスタリー
刀剣 90,精神力 40	雷光十字剣	45	180	1500	左の初撃で対象の動きを止めて右の追撃で雷ダメージを与える,※発動には左右に刀剣武器を装備する必要がある
刀剣 90,精神力 70	牙斬,(Gazan)	45	170	1000	左に持った武器で攻撃を弾き,怯んだ相手に斬撃を与える二段攻撃,発動に必要なBuff : サムライ マスタリー
刀剣 90,戦闘技術 90	真・剣聖乱舞,(Sword Ranbu)	45	530	1100	刀剣攻撃の奥義,相手に素早い剣撃を浴びせかけ 上空からの攻撃で止めを刺す,途中で空振りすると 攻撃は止まってしまう
刀剣 90,戦闘技術70	焔の舞	45	130	1200	全身に炎を纏った渾身の一撃で敵を焼き尽くす
刀剣60	ブラスト スラッシュ	28	100	900	疾風の如く 対象へ斬撃を飛ばす攻撃,発動に必要なBuff 特殊効果:ロングソード
刀剣80	Ｂ ビート,(B Beat)	38	190	1100	武器を大きく振りかぶり幾多の敵を薙ぎ払う攻撃,両手刀剣専用
刀剣80	アース ブロウ	38	260	1000	強烈な一振りから生み出された衝撃が大地を駆け抜ける,発動に必要なBuff 特殊効果:バトルアックス
