skill	name	ST	発動,時間	Delay	説明
採掘1	ホット スプリング	5	270	2000	温泉を掘り当てる※混浴です※ケンカになるので他の温泉の近くでは絶対に使用しないでください,発動に必要な装備 : つるはし
採掘30	ロック スマッシュ	15	220	870	硬い岩石やゴーレムをドリルで粉砕する技,発動に必要なBuff : 採掘魂
採掘40,伐採40	エキスパート センス,(Expert Sense)	45	140	1640	採掘と伐採の命中率を上昇させる,発動に必要なBuff : クリエイター マスタリー
栽培 1	グラス フィールド	5	60	480	wwwwwwwwwwwwwwwwwwwwwwwwwwwwww,ww種を植えて周囲に草を生やすww,wwwwwwwwwwwwwwwwwwwwwwwwwwwwww,使用アイテム : シード 10
栽培 1	クリスマスツリー召喚	5	200	1200	クリスマスツリーを設置する,クリスマスツリーを座らせるとエフェクトでライトアップされる
栽培 1	メイプル フィールド	5	60	480	周囲に紅葉が散ったフィールドを召喚する,使用アイテム : 腐葉土 1
栽培 1	もみじ召喚	5	200	1200	もみじの木を生やすことができる,もみじの木を座らせるともみじの葉が舞い散る
栽培 60,薬調合 60	マジック マッシュルーム	28	100	1300	敵を引き付ける胞子を放つ大きなキノコを召喚する,使用アイテム : 毒キノコ 1
栽培1	ブルー フラワー フィールド,(Mystic of Blue Flour Field),ピンク フラワー フィールド,ホワイト フラワー フィールド	5	60	480	お花畑を召喚する,※お花畑で座ると自然回復量が上昇する,使用アイテム : シード ×10
栽培1	一本桜	5	200	1200	一本の桜を咲かすことができる,桜の木を座らせると桜が舞い散る,※必要スキルに「栽培」がありますが、スキル値0でも使用できます。
死の魔法 70	ディメンター ソウル,(Dementor Soul)	33	200	2000	周囲に物理ダメージを与えて、与えたダメージの25%分のマナを回復する,発動に必要なBuff : ネクロマンサー マスタリー
死の魔法 70	ライフ ドレイン,(Life Drain)	33	170	1600	武器に吸魔の力を宿し、対象に与えたダメージの25%を回復する,※一部テクニックとDoT系には効果が反映されません。,発動に必要なBuff : イビルナイト マスタリー
死の魔法1	冥界送り	20	150	1000	瀕死の敵の魂を刈り取り、冥界へを送る技,※対象のHPが10%以下の場合のみ、効果が発動する,(与えることができるダメージは最大で200です。),発動に必要なBuff : アヌビスの力
死の魔法50	残夜の黒翼	23	120	1620	闇の力で身を守り、漆黒の翼が姿を隠す,発動に必要なBuff : ネクロマンサー マスタリー or イビルナイト マスタリー
死の魔法90	ダークネス フォース,(Darkness Force)	45	300	9999	自らの命を生贄に捧げ 闇の力を得る,※身体能力が大幅に上昇するが 一定時間後に術者は死ぬ,発動に必要なBuff : イビルナイト マスタリー
死体回収30,パフォーマンス30	鬼火,(Devil Fire)	15	150	2150	自分の周囲に人魂を呼び出す
持久力 1	超特急	30	0	750	超スピードで直進する,急には止まれないので注意！,※WarAgeでは効果がない,発動に必要なBuff : 高速鉄道
自然調和 1	グライディング	10	0	1200	ハンググライダーを利用して大空を滑空することが出来る,※空中で発動可能、着地で効果が解除される,※WarAgeでは効果が無い,発動に必要なBuff : ハンググライダー
自然調和 1	コントロール バーナー,(Control Burner)	5	0	400	バーナーの火力を上げて熱気球の硬度を上げる,※テクニック発動時に落下位置が変更されます。,発動に必要なBuff : 熱気球
自然調和 60	アシッド レイン,(Acid Rain)	28	280	1700	天に祈りを捧げて 強酸性の雨を降らせ、対象の防御力を低下させる,発動に必要なBuff : ドルイド マスタリー
自然調和 80	勇健の術	33	120	2120	身体を強化して毒や状態異常を解除し、一定時間防ぐ忍術,発動に必要なBuff : アサシン マスタリー と 秘奥義
自然調和 80,神秘魔法 20	水遁の術,(Ninja Art ”Water”)	38	250	1650	少量の水を触媒にして大量の水を口から吐き出す忍術,水属性ダメージと水圧によるノックバック効果を与える,発動に必要なBuff : アサシン マスタリー,使用アイテム : サモンス ウォーター
自然調和1	メダロット ステルス	35	200	2200	姿を消して不意打ちで大ダメージを与える,発動に必要なBuff : ペッパーキャット フォーム
自然調和1	グライディング フライト	5	60	1260	ムササビ スーツの飛膜を広げてグライダーのように滑空することができる,※空中で発動可能,※地面に接地すると効果が切れます。,発動に必要なBuff : ムササビ モード or 翼竜の飛翔
自然調和1	ファルコン グライディング	5	150	1350	大空へ向かって羽ばたき、空中を滑空するように移動する,※WarAgeでは効果が無い,発動に必要なBuff : 鳥になりたい
自然調和1	地中潜行	0	100	1300	地中を水中のように泳ぎながら移動できる,発動に必要なBuff : 土遁の術
自然調和30	仙気解放	30	150	2200	自然のエネルギーを身に纏い身体能力を強化する仙術,発動中は自然回復力が低下（停止）する,※WarAgeでは効果がない,発動に必要なBuff : 仙術
自然調和30,死体回収70	ソウル ハイド,(Soul Hide)	40	100	1100	自らの魂を自然に溶け込ませることにより気配を完全に消す
自然調和50	エア ジャンプ,(Air Jump)	23	0	180	空中でも発動可能な跳躍,発動に必要なBuff : アサシン マスタリー or アスリート マスタリー
自然調和50	木ノ葉風陣の術,(Ninja Art ”Leaf Guard”)	23	180	1780	自分の周囲を特殊な木の葉で覆い物理ダメージを軽減する術,発動に必要なBuff : アサシン マスタリー
自然調和60,自然回復40	ハートビート ヒーリング	28	150	1350	自然の力で対象の生命力を賦活し、継続回復効果を付与する
自然調和70,水泳70,自然回復70,持久力70	ラスト スパート,(Last Spurt)	40	60	1860	最後の力を振り絞って全力で走る
自然調和70,魔法熟練70,自然回復70	ネイチャー ヒーリング,(Nature Healing)	40	300	1500	大地の力を借りて、HP/MP/STの回復速度を高める
自然調和80	グローイング ツリー,(Growing Tree)	38	120	2120	生命の樹を呼び出し 周囲の味方を回復させる,発動に必要なBuff : ドルイド マスタリー,使用アイテム : シード×１
自然調和90,回復魔法60,魔法熟練60	大自然の息吹	100	300	7200	自然界のエネルギーを体内に取り込み魔力へ変換して放つことで,PTメンバーとペットの傷を完全に癒し、さらに負の効果を全て打ち消す
自然調和90,物まね90	霧隠れの術,(Kirigakure)	100	200	4000	自分の周りに霧を発生させて味方の姿を隠す,→ タゲ切り技,発動に必要なBuff : アサシン マスタリー
取引 1	フェアリーマルシェワゴン	30	150	750	可愛らしい荷車を召喚する
取引 1	×フラッグ召喚	5	150	750	バツが描かれた旗を召喚する,※特に効果はない
取引 1	○フラッグ召喚	5	150	750	マルが描かれた旗を召喚する,※特に効果はない
取引 1	ミニ茣蓙召喚	5	150	750	小さな茣蓙を召喚する,※ 茣蓙召喚の小さいバージョン
取引 50	リコール アンダーリング	23	200	2000	手下を呼び出して自分の代わりに戦わせる,※呼び出しには200G（J）が必要です。,発動に必要なBuff : チンピラ マスタリー or 傭兵マスタリー
取引1	こいのぼり	40	150	750	こいのぼりを立てる
取引1	のぼり召喚（メンバー募集）,(Banner ”Recruit”)	40	150	750	メンバー募集の旗を立てる
取引1	のぼり召喚（新商品）,(Banner ”New Item”)	40	150	750	新商品の旗を立てる
取引1	のぼり召喚（大安売り）,(Banner ”Bargain”)	40	150	750	大安売りの旗を立てる
取引1	のぼり召喚（冷やし中華）	40	150	750	冷やし中華の旗を立てる
取引1	フリー マーケット,(Free Market Space)	5	450	1450	フリーマーケット用のシートを足元に召喚する,※召喚した『フリマ スペース』を右クリックすることで,露店中に近くにいる客の呼び込みを行うことができる
取引1	プレゼント ボックス,(Present Box)	5	150	750	大きなプレゼントボックスを召喚する,※ 課金アイテムなので複合に記載。
取引1	茣蓙召喚,(Summon Goza)	5	150	750	***,※ 後に「ミニ茣蓙召喚」という類似の別テクニックが実装された
取引10	マイショップ(裁縫屋)	40	150	750	自分専用の裁縫屋店舗を設置することができる,「選べるマイショップボックス」の中身。緑色の屋根のお店。
取引10	マイショップ(食べ物屋),(My Shop ”Food”)	40	150	750	自分専用の食べ物屋店舗を設置することができる,「選べるマイショップボックス」の中身。黄色の屋根のお店。
取引10	マイショップ(鍛冶屋)	40	150	750	自分専用の鍛冶屋店舗を設置することができる,「選べるマイショップボックス」の中身。赤色の屋根のお店。,4種類のマイショップから１つ選んで入手できる,※アイテムスロットに1スロットの空きが必要です,※商人はついてきませんのでご注意下さい,※鍛冶屋、木工屋、裁縫屋、食べ物屋
取引10	マイショップ(木工屋)	40	150	750	自分専用の木工屋店舗を設置することができる,「選べるマイショップボックス」の中身。青色の屋根のお店。
取引12	クリスマス ショップ	25	150	1225	自分専用のクリスマス ショップを設置する事ができる,※必要スキルに「取引」がありますが、スキル値0でも使用できます。
収穫 40	エリア ハーベスト,(Area Harvest)	19	300	1200	専用の機材で周囲の草木をまとめて刈る技,発動に必要なBuff : チップソー
銃器 1	メダロット ハイパービーム	35	180	2000	ガードを貫通する強力なビームを放つ,※攻撃力と射程は武器に依存します,発動に必要なBuff : アークビートル フォーム
銃器 1	メダロット ブレイク	35	200	1800	対象の防御力に関係なく大ダメージを与える技,※攻撃力と射程は武器に依存します,発動に必要なBuff : ゴッドエンペラー フォーム
銃器 1	メダロット パワーライフル	25	130	1300	エネルギーを溜めて放つ高威力の射撃技,※攻撃力と射程は武器に依存します,発動に必要なBuff : アークビートル フォーム
銃器 1	メダロット ライフル	25	130	1200	エネルギーを溜めて放つ射撃技,※攻撃力と射程が武器に依存します,発動に必要なBuff : メタビー フォーム
銃器 1	メダロット レーザー	25	180	1400	圧縮された高エネルギーのガードを貫くレーザーを放つ技,※攻撃力と射程は武器に依存します,発動に必要なBuff : ゴッドエンペラー フォーム
銃器 1	バラージ ファイア	20	120	1600	対象に集中砲火を浴びせてダメージを与える,※銃器スキルが高いほどダメージが増加する,発動に必要なBuff : 支援ユニット
銃器 1	フレイムスロワー	20	200	1400	タンクに入った可燃性の液体を噴射して点火することで直線上に火炎を噴き出す,発動に必要なBuff : 液体燃料
銃器 1	ウォーター バズーカ,(Water Bazooka)	5	120	480	水鉄砲の水を勢い良く飛ばす専用技,発動に必要なBuff : ウォーター チャージ
銃器 70	グレネード ブラスト,(Grenade Blast)	33	250	1800	ハンド グレネードを投げつける,※爆発に巻き込まれ 自らもダメージを受ける,発動に必要なBuff:傭兵マスタリー
銃器 70	スナイパー ショット,(Sniper Shot)	33	190	910	遥か遠くにいる対象を狙い撃つことができる,攻撃を受けた者は詠唱を強制的に中断させられる,発動に必要なBuff : 傭兵 マスタリー
銃器 70	雷光弾,(Lightning Shot)	33	140	1200	ライトニング ブレイド の効果を込めて放つ魔弾,発動に必要なBuff : ライトニング ブレイド
銃器 70,精神力70	スクランブル ファイター	MP33	200	2200	魔力によって小型の戦闘機を具現化する
銃器 70,薬調合 60	睡眠ガス弾,(Sleeping Gas Shot)	33	155	1500	対象に直撃すると その周囲に強力な眠り効果のある,ガスを噴出させる,使用アイテム :グレート ソウバーリング ポーション1
銃器 80	ツイン ショット,(Twin Shot)	38	140	900	ガンファイター ハンドガン(片手銃)を装備時のみ発動可能・両手装備時は2連攻撃となる,,※（アイテムショップ）課金アイテムなので複合に記載。
銃器 80,戦闘技術 80	インファリブル ショット,(Infallible Shot)	38	140	1500	敵を捉えて狙い撃つことで確実に当てることができる技,※狙いが外れていた（ミスザマーク）場合は当たらない
銃器 80,鍛冶 40	徹甲弾	38	155	1500	金属の被帽で加工した特殊な弾で貫通力を高めて対象の装甲を貫く,※対象の防御力を無視してダメージを与える
銃器 80,破壊魔法 30	マジック ショット,(Magic Shot)	39	140	1300	魔法の弾を発射して直線上の敵を撃ち抜く
銃器 90,戦闘技術 90	アンガー スウィープ	45	200	1800	怒りにまかせて前方の敵に対して薙ぎ払うように銃を連射する,※発動には弾が最大5発必要,※狙いを定めないため、攻撃中は命中率が低下する
銃器 90,罠 70	グレネード弾,(Grenad Fire)	45	155	1500	対象に直撃するとその周囲を巻き込み燃え上がる,使用アイテム : グレート エクスプロード ポーション
銃器1	ウォーター バズーカ 2,(Water Bazooka 2)	5	120	480	水鉄砲の水を勢い良く味方に向かって飛ばす専用技,※水に濡れることで火属性ダメージを一時的に軽減する,発動に必要なBuff : ウォーター チャージ
銃器50	マシンガン プレイスメント	23	150	1950	オート機能を備えたマシンガンを設置する,※右クリックで手動による「 機銃掃射 」も可能です。,※手動で発動した方がより短い間隔で連射発動が可能です。,発動に必要なBuff : 傭兵 マスタリー
銃器60	Ｑ ショット,(Q Shot)	38	160	1200	銃器のディレイを大幅に短縮できる,※攻撃力上昇系の技や魔法と重複しません
銃器60	クイック ショット	38	160	800	攻撃力は低下するが、銃器のディレイを大幅に短縮できる,発動に必要なBuff 特殊効果:ドワーヴンライフル
銃器70,回復魔法20	ヒーリング ショット,(Healing Shot)	33	135	800	癒しの魔力を弾丸に込めて 味方を撃つ
銃器90,神秘魔法40	リコール ハンティング ガン	45	150	2500	遠隔操作が可能な4丁の猟銃を特殊召喚する技,使用アイテム : ペーパー ドール 4
盾 40	呪いの藁人形,(Curse of Straw Doll)	21	135	1200	藁人形でガード中に攻撃を受けた場合、藁人形の呪いを対象に発動する,発動に必要なBuff : 藁人形の呪い*1
盾 60	アブソーブ ガード	27	110	1460	盾でダメージ回避した分のHPを回復するガード技,※ダメージを完全回避した場合でも回復する上限は100となります,発動に必要なBuff : ウォーリアー マスタリー or ブレイブナイト マスタリー, or パーフェクト・ウォリアー or シュッツァー
盾 60	メドゥーサ ガード,(Medusa Guard)	27	135	1200	ガードに成功するとメドゥーサの瞳が発動して対象を石化させる,発動に必要なBuff : アイギスの盾
盾 60,戦闘技術 40	ブレイク カウンター,(Break Counter)	27	120	1200	相手のガードブレイク技を防いでカウンターでスタンさせる技,※通常の攻撃は防げない
盾 70	かばう	33	20	1300	味方一人のダメージを一定時間肩代わりする,※Buffが付与されていても範囲外の場合はダメージを肩代わりしません。,発動に必要なBuff : ブレイブナイト マスタリー
盾 70	ランタン ブレイド,(Lantern Blade)	33	100	900	盾についた剣で切り裂き、同時に盾に仕込まれたランタンの明かりで目つぶしの効果を与える,発動に必要なBuff : ランタン シールド*1
盾 80	ヴフト シュトース,(Mystic of Wucht Stoss)	38	170	900	対象の攻撃を受け流して 所持している武器で鋭く突き刺す,発動に必要なBuff : ヴァイス
盾 80	ショルダー チャージ	38	150	1200	防御力が高いほどに対象に大ダメージを与えることができる,発動に必要なBuff : ブレイブナイト マスタリー
盾 80,着こなし80,攻撃回避10 以下	金剛の構え	38	200	2200	その場から動けなくなるが、自分の防御力以下のダメージを無効化し、攻撃した者のヘイトを上昇させる,※一撃で防御力以上のダメージを受けた場合、効果が解除される
盾 90	キャッスル オブ ストーン	45	150	7200	不動の構えを取ると同時に石の城砦のような防御力を発揮し、ごく短時間だがあらゆるダメージを受け止める,発動に必要なBuff : ブレイブナイト マスタリー
盾 90	プロテクト ガード,(Protect Guard)	45	120	1920	範囲内にいるPTメンバーのダメージを一定時間肩代わりする,※Buffが付与されていないPTメンバーとBuffが付与されていても,範囲外のPTメンバーのダメージは肩代わりしません。,発動に必要なBuff : ウォーリアー マスタリー or ブレイブナイト マスタリー
盾1	Total Protection,(Total Protection)	5	300	35300	一度だけ物理ダメージを軽減することができる,※ダメージを93％防ぐ。ダメージを受けると効果消滅,※マカフィー シールドを装備すると必要Buff点灯,発動に必要なBuff : Total Protection Service
盾60	フォートレス	28	150	1900	防御力が上昇し、ノックバックに対して踏み止まることができる,発動に必要なBuff : ブレイブナイト マスタリー
盾90,神秘魔法70	プロテクト オーラ,(Escutcheon)	45	180	1500	守りのオーラをPTメンバーへ飛ばし、一度だけ攻撃を軽減、又は無力化する
召喚魔法 1	望遠鏡	5	150	750	遠くを見ることができる望遠鏡を設置する
召喚魔法1	かまくら,(Snow Dome)	30	150	2150	大きなかまくらを召喚する,※かまくらの中で座ると自然回復量が上昇する
召喚魔法1	ましゅかまくら	30	150	2150	いやしましゅまろの形をしたかまくらを召喚する
召喚魔法1	ブラックマジック エンハンス	20	130	1150	召喚したペットの攻撃力と魔力が上昇するが、代償にダメージが増加する,※スキルが足りなくても発動可能、召喚魔法スキルで効果量が上昇する,発動に必要なBuff : 黒魔術の書
召喚魔法1	出でよ、我が眷属！	10	150	2400	6匹のファミリア バットを同時に召喚する,ファミリア バットは吸血技を使用した時や死亡時にプレイヤーのHPを回復させる,発動に必要なBuff : 主の証,使用アイテム : アイボール 6
召喚魔法1	助けて！弁天丸,(Help BentenMaru)	5	150	10950	『宇宙海賊船 弁天丸』を別の空間から呼び寄せる。,使用アイテム : ノア クリスタル 1,※ 限定・課金アイテムなので複合に記載。
召喚魔法78	助けて！なのはさん	78	200	7800	ミッドチルダ式魔導を扱う空戦魔導師「高町なのは」を呼び出して助けてもらえる,※一度だけ「ディバインバスター」で攻撃してくれます。,※WarAgeでは呼び出せません。
神秘魔法 1	プラネタリウム	5	150	750	半球状の巨大なドームを出現させる,※WarAgeでは召喚できない
神秘魔法 50	バタフライ イリュージョン	23	150	1150	対象へ無数の幻蝶を放ちダメージを与え、鱗粉の効果で混乱させる,発動に必要なBuff : 蝶の舞
神秘魔法1	レイジングハート セットアップ！	30	600	18000	一定時間、魔法少女に変身して魔力上昇と魔法の射程増加効果を得る,※WarAgeでは使用できない,発動に必要なBuff : スタンバイモード
神秘魔法1	鏡花水月	20	100	1000	水面に映った幻の虚像を攻撃させることで物理攻撃を回避する,※物理攻撃以外を受けた場合は効果が消滅する,※スキルが足りなくても発動可能、神秘魔法スキルで効果量が上昇する,発動に必要なBuff : 水神の力
神秘魔法1	ペイント カラー(黒)	5	20	500	一定時間で消える特殊なインクで地面を真っ黒に塗りつぶす,※ 座る事で解除が可能,発動に必要なBuff : ペインター,使用アイテム : カラー インク
神秘魔法1	ペイント カラー(青)	5	20	500	一定時間で消える特殊なインクで地面を青くに塗りつぶす,※ 座る事で解除が可能,発動に必要なBuff : ペインター,使用アイテム : カラー インク
神秘魔法1	ペイント カラー(赤)	5	20	500	一定時間で消える特殊なインクで地面を赤くに塗りつぶす,※ 座る事で解除が可能,発動に必要なBuff : ペインター,使用アイテム : カラー インク
神秘魔法1	ペイント カラー(緑)	5	20	500	一定時間で消える特殊なインクで地面を緑に塗りつぶす,※ 座る事で解除が可能,発動に必要なBuff : ペインター,使用アイテム : カラー インク
神秘魔法1	ボリテイション,(Volitation)	5	20	1000	レビテイション中に使用することで一定時間飛行能力を得ることができる,※高低差を変更することはできません。,発動に必要なBuff : レビテイション
神秘魔法1	マジカル ウィグル ブラシ,(Magical Wiggle brush)	5	20	500	僅かな魔力で誰でも使えるアートスペル,足元に残したラインがくねくねと動き出す,※座る事で解除が可能,使用アイテム : カラーインク1
神秘魔法1	マジカル ブラシ(青),(Magical Brush Blue)	5	20	500	足元に色を残しラインを描くことができる,使用アイテム : カラー インク
神秘魔法1	マジカル ブラシ(赤),(Magical Brush Red)	5	20	500	足元に色を残しラインを描くことができる,使用アイテム : カラー インク
神秘魔法1	マジカル ブラシ(緑),(Magical Brush Green)	5	20	500	足元に色を残しラインを描くことができる,使用アイテム : カラー インク
神秘魔法1	マジカル ルーレット	5	150	1650	ルーレットで止まった色によってさまざまな効果が付与される魔法具を召喚する,※最大で一度に5種類まで付与されるが、ドクロに止まった場合は全てのBUFFが解除されて、HP/ST/MPが1になる,※1プレイ：500G
神秘魔法1	レビテイション,(Levitation)	5	200	800	その場で浮くことができる
神秘魔法1	ホーム レコード	0	100	500	ホームレコーダーを介して、レコードポイント/ホームポイントを記録する
神秘魔法30	ムーン フォース	15	250	2050	月の光を浴びることで魔力と呪文抵抗力が上昇する,※夜の間は効果が2倍になる,発動に必要なBuff : 月の加護
神秘魔法80,強化魔法80	グラビティアクシス	38	150	2150	時間の流れが加速する特殊な領域を展開する
神秘魔法90,呪文抵抗力80	タケミカヅチ,(Takemikaduchi)	45	120	3720	己の肉体に雷の力を取り込み、反応速度を極限まで高める技,※効果が切れると反動により、HP/ST/MPが激減する
水泳 1	ファイティング ウオ	10	150	1500	果敢に戦う魚達を5匹呼び出す,発動に必要なBuff : クマノミの加護
水泳 30	Ｃ.Ｒ.Ｌ	19	20	1520	走るよりも早く地面を泳ぐように移動することが出来る,※WarAgeでは効果が無い
水泳 60	鮪型魚雷	28	150	1050	追尾式の鮪型魚雷を操り敵を撃沈する,※地上でも発動可能です,発動に必要なBuff : 海戦士 マスタリー
水泳 60,自然調和60	ダイビング グラウンド	28	20	1500	地面に潜って地面を水面のように泳ぐことができる,効果中は移動速度で少し上昇して物理攻撃がすり抜ける,※ジャンプや行動で解除される
水泳 90	ネプチューン スキン,(Neptune Skin)	45	180	2000	海神の加護で水属性の攻撃を吸収して、回復に変換することができる。,発動に必要なBuff : 海戦士 マスタリー
